No.     Time           Source                Destination           Protocol Length Info
      1 0.000000       81.20.48.162          192.168.1.127         TCP      1514   443 → 61541 [ACK] Seq=1 Ack=1 Win=258 Len=1448 TSval=3297640315 TSecr=777734488 [TCP segment of a reassembled PDU]

Frame 1: 1514 bytes on wire (12112 bits), 1514 bytes captured (12112 bits) on interface en0, id 0
Ethernet II, Src: Cisco-Li_4e:60:1e (c8:d7:19:4e:60:1e), Dst: Apple_2b:95:95 (f8:ff:c2:2b:95:95)
Internet Protocol Version 4, Src: 81.20.48.162, Dst: 192.168.1.127
Transmission Control Protocol, Src Port: 443, Dst Port: 61541, Seq: 1, Ack: 1, Len: 1448

No.     Time           Source                Destination           Protocol Length Info
      2 0.000006       81.20.48.162          192.168.1.127         TLSv1.2  1102   Application Data

Frame 2: 1102 bytes on wire (8816 bits), 1102 bytes captured (8816 bits) on interface en0, id 0
Ethernet II, Src: Cisco-Li_4e:60:1e (c8:d7:19:4e:60:1e), Dst: Apple_2b:95:95 (f8:ff:c2:2b:95:95)
Internet Protocol Version 4, Src: 81.20.48.162, Dst: 192.168.1.127
Transmission Control Protocol, Src Port: 443, Dst Port: 61541, Seq: 1449, Ack: 1, Len: 1036
[2 Reassembled TCP Segments (2484 bytes): #1(1448), #2(1036)]
Transport Layer Security

No.     Time           Source                Destination           Protocol Length Info
      3 0.000108       192.168.1.127         81.20.48.162          TCP      66     61541 → 443 [ACK] Seq=1 Ack=2485 Win=2009 Len=0 TSval=777734966 TSecr=3297640315

Frame 3: 66 bytes on wire (528 bits), 66 bytes captured (528 bits) on interface en0, id 0
Ethernet II, Src: Apple_2b:95:95 (f8:ff:c2:2b:95:95), Dst: Cisco-Li_4e:60:1e (c8:d7:19:4e:60:1e)
Internet Protocol Version 4, Src: 192.168.1.127, Dst: 81.20.48.162
Transmission Control Protocol, Src Port: 61541, Dst Port: 443, Seq: 1, Ack: 2485, Len: 0

No.     Time           Source                Destination           Protocol Length Info
      4 0.409357       81.20.48.162          192.168.1.127         TCP      1514   443 → 61541 [ACK] Seq=2485 Ack=1 Win=258 Len=1448 TSval=3297640416 TSecr=777734966 [TCP segment of a reassembled PDU]

Frame 4: 1514 bytes on wire (12112 bits), 1514 bytes captured (12112 bits) on interface en0, id 0
Ethernet II, Src: Cisco-Li_4e:60:1e (c8:d7:19:4e:60:1e), Dst: Apple_2b:95:95 (f8:ff:c2:2b:95:95)
Internet Protocol Version 4, Src: 81.20.48.162, Dst: 192.168.1.127
Transmission Control Protocol, Src Port: 443, Dst Port: 61541, Seq: 2485, Ack: 1, Len: 1448

No.     Time           Source                Destination           Protocol Length Info
      5 0.409363       81.20.48.162          192.168.1.127         TLSv1.2  1014   Application Data

Frame 5: 1014 bytes on wire (8112 bits), 1014 bytes captured (8112 bits) on interface en0, id 0
Ethernet II, Src: Cisco-Li_4e:60:1e (c8:d7:19:4e:60:1e), Dst: Apple_2b:95:95 (f8:ff:c2:2b:95:95)
Internet Protocol Version 4, Src: 81.20.48.162, Dst: 192.168.1.127
Transmission Control Protocol, Src Port: 443, Dst Port: 61541, Seq: 3933, Ack: 1, Len: 948
[2 Reassembled TCP Segments (2396 bytes): #4(1448), #5(948)]
Transport Layer Security

No.     Time           Source                Destination           Protocol Length Info
      6 0.409423       192.168.1.127         81.20.48.162          TCP      66     61541 → 443 [ACK] Seq=1 Ack=4881 Win=2010 Len=0 TSval=777735368 TSecr=3297640416

Frame 6: 66 bytes on wire (528 bits), 66 bytes captured (528 bits) on interface en0, id 0
Ethernet II, Src: Apple_2b:95:95 (f8:ff:c2:2b:95:95), Dst: Cisco-Li_4e:60:1e (c8:d7:19:4e:60:1e)
Internet Protocol Version 4, Src: 192.168.1.127, Dst: 81.20.48.162
Transmission Control Protocol, Src Port: 61541, Dst Port: 443, Seq: 1, Ack: 4881, Len: 0

No.     Time           Source                Destination           Protocol Length Info
      7 0.819033       81.20.48.162          192.168.1.127         TCP      1514   443 → 61541 [ACK] Seq=4881 Ack=1 Win=258 Len=1448 TSval=3297640516 TSecr=777735368 [TCP segment of a reassembled PDU]

Frame 7: 1514 bytes on wire (12112 bits), 1514 bytes captured (12112 bits) on interface en0, id 0
Ethernet II, Src: Cisco-Li_4e:60:1e (c8:d7:19:4e:60:1e), Dst: Apple_2b:95:95 (f8:ff:c2:2b:95:95)
Internet Protocol Version 4, Src: 81.20.48.162, Dst: 192.168.1.127
Transmission Control Protocol, Src Port: 443, Dst Port: 61541, Seq: 4881, Ack: 1, Len: 1448

No.     Time           Source                Destination           Protocol Length Info
      8 0.819038       81.20.48.162          192.168.1.127         TLSv1.2  1085   Application Data

Frame 8: 1085 bytes on wire (8680 bits), 1085 bytes captured (8680 bits) on interface en0, id 0
Ethernet II, Src: Cisco-Li_4e:60:1e (c8:d7:19:4e:60:1e), Dst: Apple_2b:95:95 (f8:ff:c2:2b:95:95)
Internet Protocol Version 4, Src: 81.20.48.162, Dst: 192.168.1.127
Transmission Control Protocol, Src Port: 443, Dst Port: 61541, Seq: 6329, Ack: 1, Len: 1019
[2 Reassembled TCP Segments (2467 bytes): #7(1448), #8(1019)]
Transport Layer Security

No.     Time           Source                Destination           Protocol Length Info
      9 0.819117       192.168.1.127         81.20.48.162          TCP      66     61541 → 443 [ACK] Seq=1 Ack=7348 Win=2009 Len=0 TSval=777735772 TSecr=3297640516

Frame 9: 66 bytes on wire (528 bits), 66 bytes captured (528 bits) on interface en0, id 0
Ethernet II, Src: Apple_2b:95:95 (f8:ff:c2:2b:95:95), Dst: Cisco-Li_4e:60:1e (c8:d7:19:4e:60:1e)
Internet Protocol Version 4, Src: 192.168.1.127, Dst: 81.20.48.162
Transmission Control Protocol, Src Port: 61541, Dst Port: 443, Seq: 1, Ack: 7348, Len: 0

No.     Time           Source                Destination           Protocol Length Info
     10 1.125924       81.20.48.162          192.168.1.127         TCP      1514   443 → 61541 [ACK] Seq=7348 Ack=1 Win=258 Len=1448 TSval=3297640616 TSecr=777735772 [TCP segment of a reassembled PDU]

Frame 10: 1514 bytes on wire (12112 bits), 1514 bytes captured (12112 bits) on interface en0, id 0
Ethernet II, Src: Cisco-Li_4e:60:1e (c8:d7:19:4e:60:1e), Dst: Apple_2b:95:95 (f8:ff:c2:2b:95:95)
Internet Protocol Version 4, Src: 81.20.48.162, Dst: 192.168.1.127
Transmission Control Protocol, Src Port: 443, Dst Port: 61541, Seq: 7348, Ack: 1, Len: 1448

No.     Time           Source                Destination           Protocol Length Info
     11 1.125963       81.20.48.162          192.168.1.127         TLSv1.2  1253   Application Data

Frame 11: 1253 bytes on wire (10024 bits), 1253 bytes captured (10024 bits) on interface en0, id 0
Ethernet II, Src: Cisco-Li_4e:60:1e (c8:d7:19:4e:60:1e), Dst: Apple_2b:95:95 (f8:ff:c2:2b:95:95)
Internet Protocol Version 4, Src: 81.20.48.162, Dst: 192.168.1.127
Transmission Control Protocol, Src Port: 443, Dst Port: 61541, Seq: 8796, Ack: 1, Len: 1187
[2 Reassembled TCP Segments (2635 bytes): #10(1448), #11(1187)]
Transport Layer Security

No.     Time           Source                Destination           Protocol Length Info
     12 1.125996       192.168.1.127         81.20.48.162          TCP      66     61541 → 443 [ACK] Seq=1 Ack=9983 Win=2006 Len=0 TSval=777736077 TSecr=3297640616

Frame 12: 66 bytes on wire (528 bits), 66 bytes captured (528 bits) on interface en0, id 0
Ethernet II, Src: Apple_2b:95:95 (f8:ff:c2:2b:95:95), Dst: Cisco-Li_4e:60:1e (c8:d7:19:4e:60:1e)
Internet Protocol Version 4, Src: 192.168.1.127, Dst: 81.20.48.162
Transmission Control Protocol, Src Port: 61541, Dst Port: 443, Seq: 1, Ack: 9983, Len: 0

No.     Time           Source                Destination           Protocol Length Info
     13 1.535844       81.20.48.162          192.168.1.127         TCP      1514   443 → 61541 [ACK] Seq=9983 Ack=1 Win=258 Len=1448 TSval=3297640716 TSecr=777736077 [TCP segment of a reassembled PDU]

Frame 13: 1514 bytes on wire (12112 bits), 1514 bytes captured (12112 bits) on interface en0, id 0
Ethernet II, Src: Cisco-Li_4e:60:1e (c8:d7:19:4e:60:1e), Dst: Apple_2b:95:95 (f8:ff:c2:2b:95:95)
Internet Protocol Version 4, Src: 81.20.48.162, Dst: 192.168.1.127
Transmission Control Protocol, Src Port: 443, Dst Port: 61541, Seq: 9983, Ack: 1, Len: 1448

No.     Time           Source                Destination           Protocol Length Info
     14 1.535846       81.20.48.162          192.168.1.127         TLSv1.2  832    Application Data

Frame 14: 832 bytes on wire (6656 bits), 832 bytes captured (6656 bits) on interface en0, id 0
Ethernet II, Src: Cisco-Li_4e:60:1e (c8:d7:19:4e:60:1e), Dst: Apple_2b:95:95 (f8:ff:c2:2b:95:95)
Internet Protocol Version 4, Src: 81.20.48.162, Dst: 192.168.1.127
Transmission Control Protocol, Src Port: 443, Dst Port: 61541, Seq: 11431, Ack: 1, Len: 766
[2 Reassembled TCP Segments (2214 bytes): #13(1448), #14(766)]
Transport Layer Security

No.     Time           Source                Destination           Protocol Length Info
     15 1.535907       192.168.1.127         81.20.48.162          TCP      66     61541 → 443 [ACK] Seq=1 Ack=12197 Win=2013 Len=0 TSval=777736486 TSecr=3297640716

Frame 15: 66 bytes on wire (528 bits), 66 bytes captured (528 bits) on interface en0, id 0
Ethernet II, Src: Apple_2b:95:95 (f8:ff:c2:2b:95:95), Dst: Cisco-Li_4e:60:1e (c8:d7:19:4e:60:1e)
Internet Protocol Version 4, Src: 192.168.1.127, Dst: 81.20.48.162
Transmission Control Protocol, Src Port: 61541, Dst Port: 443, Seq: 1, Ack: 12197, Len: 0

No.     Time           Source                Destination           Protocol Length Info
     16 1.945452       81.20.48.162          192.168.1.127         TCP      1514   443 → 61541 [ACK] Seq=12197 Ack=1 Win=258 Len=1448 TSval=3297640815 TSecr=777736486 [TCP segment of a reassembled PDU]

Frame 16: 1514 bytes on wire (12112 bits), 1514 bytes captured (12112 bits) on interface en0, id 0
Ethernet II, Src: Cisco-Li_4e:60:1e (c8:d7:19:4e:60:1e), Dst: Apple_2b:95:95 (f8:ff:c2:2b:95:95)
Internet Protocol Version 4, Src: 81.20.48.162, Dst: 192.168.1.127
Transmission Control Protocol, Src Port: 443, Dst Port: 61541, Seq: 12197, Ack: 1, Len: 1448

No.     Time           Source                Destination           Protocol Length Info
     17 1.945455       81.20.48.162          192.168.1.127         TLSv1.2  1201   Application Data

Frame 17: 1201 bytes on wire (9608 bits), 1201 bytes captured (9608 bits) on interface en0, id 0
Ethernet II, Src: Cisco-Li_4e:60:1e (c8:d7:19:4e:60:1e), Dst: Apple_2b:95:95 (f8:ff:c2:2b:95:95)
Internet Protocol Version 4, Src: 81.20.48.162, Dst: 192.168.1.127
Transmission Control Protocol, Src Port: 443, Dst Port: 61541, Seq: 13645, Ack: 1, Len: 1135
[2 Reassembled TCP Segments (2583 bytes): #16(1448), #17(1135)]
Transport Layer Security

No.     Time           Source                Destination           Protocol Length Info
     18 1.945513       192.168.1.127         81.20.48.162          TCP      66     61541 → 443 [ACK] Seq=1 Ack=14780 Win=2007 Len=0 TSval=777736894 TSecr=3297640815

Frame 18: 66 bytes on wire (528 bits), 66 bytes captured (528 bits) on interface en0, id 0
Ethernet II, Src: Apple_2b:95:95 (f8:ff:c2:2b:95:95), Dst: Cisco-Li_4e:60:1e (c8:d7:19:4e:60:1e)
Internet Protocol Version 4, Src: 192.168.1.127, Dst: 81.20.48.162
Transmission Control Protocol, Src Port: 61541, Dst Port: 443, Seq: 1, Ack: 14780, Len: 0

No.     Time           Source                Destination           Protocol Length Info
     19 2.355062       81.20.48.162          192.168.1.127         TCP      1514   443 → 61541 [ACK] Seq=14780 Ack=1 Win=258 Len=1448 TSval=3297640915 TSecr=777736894 [TCP segment of a reassembled PDU]

Frame 19: 1514 bytes on wire (12112 bits), 1514 bytes captured (12112 bits) on interface en0, id 0
Ethernet II, Src: Cisco-Li_4e:60:1e (c8:d7:19:4e:60:1e), Dst: Apple_2b:95:95 (f8:ff:c2:2b:95:95)
Internet Protocol Version 4, Src: 81.20.48.162, Dst: 192.168.1.127
Transmission Control Protocol, Src Port: 443, Dst Port: 61541, Seq: 14780, Ack: 1, Len: 1448

No.     Time           Source                Destination           Protocol Length Info
     20 2.355066       81.20.48.162          192.168.1.127         TLSv1.2  827    Application Data

Frame 20: 827 bytes on wire (6616 bits), 827 bytes captured (6616 bits) on interface en0, id 0
Ethernet II, Src: Cisco-Li_4e:60:1e (c8:d7:19:4e:60:1e), Dst: Apple_2b:95:95 (f8:ff:c2:2b:95:95)
Internet Protocol Version 4, Src: 81.20.48.162, Dst: 192.168.1.127
Transmission Control Protocol, Src Port: 443, Dst Port: 61541, Seq: 16228, Ack: 1, Len: 761
[2 Reassembled TCP Segments (2209 bytes): #19(1448), #20(761)]
Transport Layer Security

No.     Time           Source                Destination           Protocol Length Info
     21 2.355121       192.168.1.127         81.20.48.162          TCP      66     61541 → 443 [ACK] Seq=1 Ack=16989 Win=2013 Len=0 TSval=777737302 TSecr=3297640915

Frame 21: 66 bytes on wire (528 bits), 66 bytes captured (528 bits) on interface en0, id 0
Ethernet II, Src: Apple_2b:95:95 (f8:ff:c2:2b:95:95), Dst: Cisco-Li_4e:60:1e (c8:d7:19:4e:60:1e)
Internet Protocol Version 4, Src: 192.168.1.127, Dst: 81.20.48.162
Transmission Control Protocol, Src Port: 61541, Dst Port: 443, Seq: 1, Ack: 16989, Len: 0

No.     Time           Source                Destination           Protocol Length Info
     22 2.369026       192.168.1.127         172.217.16.14         TLSv1.2  241    Application Data

Frame 22: 241 bytes on wire (1928 bits), 241 bytes captured (1928 bits) on interface en0, id 0
Ethernet II, Src: Apple_2b:95:95 (f8:ff:c2:2b:95:95), Dst: Cisco-Li_4e:60:1e (c8:d7:19:4e:60:1e)
Internet Protocol Version 4, Src: 192.168.1.127, Dst: 172.217.16.14
Transmission Control Protocol, Src Port: 62243, Dst Port: 443, Seq: 1, Ack: 1, Len: 175
Transport Layer Security

No.     Time           Source                Destination           Protocol Length Info
     23 2.369056       192.168.1.127         172.217.16.14         TLSv1.2  105    Application Data

Frame 23: 105 bytes on wire (840 bits), 105 bytes captured (840 bits) on interface en0, id 0
Ethernet II, Src: Apple_2b:95:95 (f8:ff:c2:2b:95:95), Dst: Cisco-Li_4e:60:1e (c8:d7:19:4e:60:1e)
Internet Protocol Version 4, Src: 192.168.1.127, Dst: 172.217.16.14
Transmission Control Protocol, Src Port: 62243, Dst Port: 443, Seq: 176, Ack: 1, Len: 39
Transport Layer Security

No.     Time           Source                Destination           Protocol Length Info
     24 2.369056       192.168.1.127         172.217.16.14         TLSv1.2  556    Application Data

Frame 24: 556 bytes on wire (4448 bits), 556 bytes captured (4448 bits) on interface en0, id 0
Ethernet II, Src: Apple_2b:95:95 (f8:ff:c2:2b:95:95), Dst: Cisco-Li_4e:60:1e (c8:d7:19:4e:60:1e)
Internet Protocol Version 4, Src: 192.168.1.127, Dst: 172.217.16.14
Transmission Control Protocol, Src Port: 62243, Dst Port: 443, Seq: 215, Ack: 1, Len: 490
Transport Layer Security

No.     Time           Source                Destination           Protocol Length Info
     25 2.384936       172.217.16.14         192.168.1.127         TCP      66     443 → 62243 [ACK] Seq=1 Ack=176 Win=1050 Len=0 TSval=854526855 TSecr=777737315

Frame 25: 66 bytes on wire (528 bits), 66 bytes captured (528 bits) on interface en0, id 0
Ethernet II, Src: Cisco-Li_4e:60:1e (c8:d7:19:4e:60:1e), Dst: Apple_2b:95:95 (f8:ff:c2:2b:95:95)
Internet Protocol Version 4, Src: 172.217.16.14, Dst: 192.168.1.127
Transmission Control Protocol, Src Port: 443, Dst Port: 62243, Seq: 1, Ack: 176, Len: 0

No.     Time           Source                Destination           Protocol Length Info
     26 2.384940       172.217.16.14         192.168.1.127         TCP      66     443 → 62243 [ACK] Seq=1 Ack=215 Win=1050 Len=0 TSval=854526855 TSecr=777737315

Frame 26: 66 bytes on wire (528 bits), 66 bytes captured (528 bits) on interface en0, id 0
Ethernet II, Src: Cisco-Li_4e:60:1e (c8:d7:19:4e:60:1e), Dst: Apple_2b:95:95 (f8:ff:c2:2b:95:95)
Internet Protocol Version 4, Src: 172.217.16.14, Dst: 192.168.1.127
Transmission Control Protocol, Src Port: 443, Dst Port: 62243, Seq: 1, Ack: 215, Len: 0

No.     Time           Source                Destination           Protocol Length Info
     27 2.385263       172.217.16.14         192.168.1.127         TCP      66     443 → 62243 [ACK] Seq=1 Ack=705 Win=1049 Len=0 TSval=854526855 TSecr=777737315

Frame 27: 66 bytes on wire (528 bits), 66 bytes captured (528 bits) on interface en0, id 0
Ethernet II, Src: Cisco-Li_4e:60:1e (c8:d7:19:4e:60:1e), Dst: Apple_2b:95:95 (f8:ff:c2:2b:95:95)
Internet Protocol Version 4, Src: 172.217.16.14, Dst: 192.168.1.127
Transmission Control Protocol, Src Port: 443, Dst Port: 62243, Seq: 1, Ack: 705, Len: 0

No.     Time           Source                Destination           Protocol Length Info
     28 2.385266       172.217.16.14         192.168.1.127         TLSv1.2  105    Application Data

Frame 28: 105 bytes on wire (840 bits), 105 bytes captured (840 bits) on interface en0, id 0
Ethernet II, Src: Cisco-Li_4e:60:1e (c8:d7:19:4e:60:1e), Dst: Apple_2b:95:95 (f8:ff:c2:2b:95:95)
Internet Protocol Version 4, Src: 172.217.16.14, Dst: 192.168.1.127
Transmission Control Protocol, Src Port: 443, Dst Port: 62243, Seq: 1, Ack: 705, Len: 39
Transport Layer Security

No.     Time           Source                Destination           Protocol Length Info
     29 2.385309       192.168.1.127         172.217.16.14         TCP      66     62243 → 443 [ACK] Seq=705 Ack=40 Win=2047 Len=0 TSval=777737330 TSecr=854526856

Frame 29: 66 bytes on wire (528 bits), 66 bytes captured (528 bits) on interface en0, id 0
Ethernet II, Src: Apple_2b:95:95 (f8:ff:c2:2b:95:95), Dst: Cisco-Li_4e:60:1e (c8:d7:19:4e:60:1e)
Internet Protocol Version 4, Src: 192.168.1.127, Dst: 172.217.16.14
Transmission Control Protocol, Src Port: 62243, Dst Port: 443, Seq: 705, Ack: 40, Len: 0

No.     Time           Source                Destination           Protocol Length Info
     30 2.437211       172.217.16.14         192.168.1.127         TLSv1.2  287    Application Data

Frame 30: 287 bytes on wire (2296 bits), 287 bytes captured (2296 bits) on interface en0, id 0
Ethernet II, Src: Cisco-Li_4e:60:1e (c8:d7:19:4e:60:1e), Dst: Apple_2b:95:95 (f8:ff:c2:2b:95:95)
Internet Protocol Version 4, Src: 172.217.16.14, Dst: 192.168.1.127
Transmission Control Protocol, Src Port: 443, Dst Port: 62243, Seq: 40, Ack: 705, Len: 221
Transport Layer Security

No.     Time           Source                Destination           Protocol Length Info
     31 2.437213       172.217.16.14         192.168.1.127         TLSv1.2  447    Application Data

Frame 31: 447 bytes on wire (3576 bits), 447 bytes captured (3576 bits) on interface en0, id 0
Ethernet II, Src: Cisco-Li_4e:60:1e (c8:d7:19:4e:60:1e), Dst: Apple_2b:95:95 (f8:ff:c2:2b:95:95)
Internet Protocol Version 4, Src: 172.217.16.14, Dst: 192.168.1.127
Transmission Control Protocol, Src Port: 443, Dst Port: 62243, Seq: 261, Ack: 705, Len: 381
Transport Layer Security

No.     Time           Source                Destination           Protocol Length Info
     32 2.437259       192.168.1.127         172.217.16.14         TCP      66     62243 → 443 [ACK] Seq=705 Ack=261 Win=2044 Len=0 TSval=777737382 TSecr=854526907

Frame 32: 66 bytes on wire (528 bits), 66 bytes captured (528 bits) on interface en0, id 0
Ethernet II, Src: Apple_2b:95:95 (f8:ff:c2:2b:95:95), Dst: Cisco-Li_4e:60:1e (c8:d7:19:4e:60:1e)
Internet Protocol Version 4, Src: 192.168.1.127, Dst: 172.217.16.14
Transmission Control Protocol, Src Port: 62243, Dst Port: 443, Seq: 705, Ack: 261, Len: 0

No.     Time           Source                Destination           Protocol Length Info
     33 2.437259       192.168.1.127         172.217.16.14         TCP      66     62243 → 443 [ACK] Seq=705 Ack=642 Win=2038 Len=0 TSval=777737382 TSecr=854526907

Frame 33: 66 bytes on wire (528 bits), 66 bytes captured (528 bits) on interface en0, id 0
Ethernet II, Src: Apple_2b:95:95 (f8:ff:c2:2b:95:95), Dst: Cisco-Li_4e:60:1e (c8:d7:19:4e:60:1e)
Internet Protocol Version 4, Src: 192.168.1.127, Dst: 172.217.16.14
Transmission Control Protocol, Src Port: 62243, Dst Port: 443, Seq: 705, Ack: 642, Len: 0

No.     Time           Source                Destination           Protocol Length Info
     34 2.437531       172.217.16.14         192.168.1.127         TLSv1.2  129    Application Data

Frame 34: 129 bytes on wire (1032 bits), 129 bytes captured (1032 bits) on interface en0, id 0
Ethernet II, Src: Cisco-Li_4e:60:1e (c8:d7:19:4e:60:1e), Dst: Apple_2b:95:95 (f8:ff:c2:2b:95:95)
Internet Protocol Version 4, Src: 172.217.16.14, Dst: 192.168.1.127
Transmission Control Protocol, Src Port: 443, Dst Port: 62243, Seq: 642, Ack: 705, Len: 63
Transport Layer Security

No.     Time           Source                Destination           Protocol Length Info
     35 2.437533       172.217.16.14         192.168.1.127         TLSv1.2  105    Application Data

Frame 35: 105 bytes on wire (840 bits), 105 bytes captured (840 bits) on interface en0, id 0
Ethernet II, Src: Cisco-Li_4e:60:1e (c8:d7:19:4e:60:1e), Dst: Apple_2b:95:95 (f8:ff:c2:2b:95:95)
Internet Protocol Version 4, Src: 172.217.16.14, Dst: 192.168.1.127
Transmission Control Protocol, Src Port: 443, Dst Port: 62243, Seq: 705, Ack: 705, Len: 39
Transport Layer Security

No.     Time           Source                Destination           Protocol Length Info
     36 2.437562       192.168.1.127         172.217.16.14         TCP      66     62243 → 443 [ACK] Seq=705 Ack=705 Win=2047 Len=0 TSval=777737382 TSecr=854526908

Frame 36: 66 bytes on wire (528 bits), 66 bytes captured (528 bits) on interface en0, id 0
Ethernet II, Src: Apple_2b:95:95 (f8:ff:c2:2b:95:95), Dst: Cisco-Li_4e:60:1e (c8:d7:19:4e:60:1e)
Internet Protocol Version 4, Src: 192.168.1.127, Dst: 172.217.16.14
Transmission Control Protocol, Src Port: 62243, Dst Port: 443, Seq: 705, Ack: 705, Len: 0

No.     Time           Source                Destination           Protocol Length Info
     37 2.437579       192.168.1.127         172.217.16.14         TCP      66     62243 → 443 [ACK] Seq=705 Ack=744 Win=2046 Len=0 TSval=777737382 TSecr=854526908

Frame 37: 66 bytes on wire (528 bits), 66 bytes captured (528 bits) on interface en0, id 0
Ethernet II, Src: Apple_2b:95:95 (f8:ff:c2:2b:95:95), Dst: Cisco-Li_4e:60:1e (c8:d7:19:4e:60:1e)
Internet Protocol Version 4, Src: 192.168.1.127, Dst: 172.217.16.14
Transmission Control Protocol, Src Port: 62243, Dst Port: 443, Seq: 705, Ack: 744, Len: 0

No.     Time           Source                Destination           Protocol Length Info
     38 2.437629       192.168.1.127         172.217.16.14         TLSv1.2  105    Application Data

Frame 38: 105 bytes on wire (840 bits), 105 bytes captured (840 bits) on interface en0, id 0
Ethernet II, Src: Apple_2b:95:95 (f8:ff:c2:2b:95:95), Dst: Cisco-Li_4e:60:1e (c8:d7:19:4e:60:1e)
Internet Protocol Version 4, Src: 192.168.1.127, Dst: 172.217.16.14
Transmission Control Protocol, Src Port: 62243, Dst Port: 443, Seq: 705, Ack: 744, Len: 39
Transport Layer Security

No.     Time           Source                Destination           Protocol Length Info
     39 2.441547       192.168.1.127         192.168.1.1           DNS      74     Standard query 0x3492 A www.google.com

Frame 39: 74 bytes on wire (592 bits), 74 bytes captured (592 bits) on interface en0, id 0
Ethernet II, Src: Apple_2b:95:95 (f8:ff:c2:2b:95:95), Dst: Cisco-Li_4e:60:1e (c8:d7:19:4e:60:1e)
Internet Protocol Version 4, Src: 192.168.1.127, Dst: 192.168.1.1
User Datagram Protocol, Src Port: 10186, Dst Port: 53
    Source Port: 10186
    Destination Port: 53
    Length: 40
    Checksum: 0x9094 [unverified]
    [Checksum Status: Unverified]
    [Stream index: 0]
    [Timestamps]
Domain Name System (query)
    Transaction ID: 0x3492
    Flags: 0x0100 Standard query
    Questions: 1
    Answer RRs: 0
    Authority RRs: 0
    Additional RRs: 0
    Queries
    [Response In: 40]

No.     Time           Source                Destination           Protocol Length Info
     40 2.443615       192.168.1.1           192.168.1.127         DNS      338    Standard query response 0x3492 A www.google.com A 216.58.215.68 NS ns4.google.com NS ns3.google.com NS ns2.google.com NS ns1.google.com A 216.239.32.10 A 216.239.34.10 A 216.239.36.10 A 216.239.38.10 AAAA 2001:4860:4802:32::a AAAA 2001:4860:4802:34::a AAAA 2001:4860:4802:36::a AAAA 2001:4860:4802:38::a

Frame 40: 338 bytes on wire (2704 bits), 338 bytes captured (2704 bits) on interface en0, id 0
Ethernet II, Src: Cisco-Li_4e:60:1e (c8:d7:19:4e:60:1e), Dst: Apple_2b:95:95 (f8:ff:c2:2b:95:95)
Internet Protocol Version 4, Src: 192.168.1.1, Dst: 192.168.1.127
User Datagram Protocol, Src Port: 53, Dst Port: 10186
    Source Port: 53
    Destination Port: 10186
    Length: 304
    Checksum: 0xd473 [unverified]
    [Checksum Status: Unverified]
    [Stream index: 0]
    [Timestamps]
Domain Name System (response)
    Transaction ID: 0x3492
    Flags: 0x8180 Standard query response, No error
    Questions: 1
    Answer RRs: 1
    Authority RRs: 4
    Additional RRs: 8
    Queries
    Answers
        www.google.com: type A, class IN, addr 216.58.215.68
            Name: www.google.com
            Type: A (Host Address) (1)
            Class: IN (0x0001)
            Time to live: 130 (2 minutes, 10 seconds)
            Data length: 4
            Address: 216.58.215.68
    Authoritative nameservers
        google.com: type NS, class IN, ns ns4.google.com
            Name: google.com
            Type: NS (authoritative Name Server) (2)
            Class: IN (0x0001)
            Time to live: 148958 (1 day, 17 hours, 22 minutes, 38 seconds)
            Data length: 6
            Name Server: ns4.google.com
        google.com: type NS, class IN, ns ns3.google.com
            Name: google.com
            Type: NS (authoritative Name Server) (2)
            Class: IN (0x0001)
            Time to live: 148958 (1 day, 17 hours, 22 minutes, 38 seconds)
            Data length: 6
            Name Server: ns3.google.com
        google.com: type NS, class IN, ns ns2.google.com
            Name: google.com
            Type: NS (authoritative Name Server) (2)
            Class: IN (0x0001)
            Time to live: 148958 (1 day, 17 hours, 22 minutes, 38 seconds)
            Data length: 6
            Name Server: ns2.google.com
        google.com: type NS, class IN, ns ns1.google.com
            Name: google.com
            Type: NS (authoritative Name Server) (2)
            Class: IN (0x0001)
            Time to live: 148958 (1 day, 17 hours, 22 minutes, 38 seconds)
            Data length: 6
            Name Server: ns1.google.com
    Additional records
        ns1.google.com: type A, class IN, addr 216.239.32.10
            Name: ns1.google.com
            Type: A (Host Address) (1)
            Class: IN (0x0001)
            Time to live: 156694 (1 day, 19 hours, 31 minutes, 34 seconds)
            Data length: 4
            Address: 216.239.32.10
        ns2.google.com: type A, class IN, addr 216.239.34.10
            Name: ns2.google.com
            Type: A (Host Address) (1)
            Class: IN (0x0001)
            Time to live: 156694 (1 day, 19 hours, 31 minutes, 34 seconds)
            Data length: 4
            Address: 216.239.34.10
        ns3.google.com: type A, class IN, addr 216.239.36.10
            Name: ns3.google.com
            Type: A (Host Address) (1)
            Class: IN (0x0001)
            Time to live: 156694 (1 day, 19 hours, 31 minutes, 34 seconds)
            Data length: 4
            Address: 216.239.36.10
        ns4.google.com: type A, class IN, addr 216.239.38.10
            Name: ns4.google.com
            Type: A (Host Address) (1)
            Class: IN (0x0001)
            Time to live: 156694 (1 day, 19 hours, 31 minutes, 34 seconds)
            Data length: 4
            Address: 216.239.38.10
        ns1.google.com: type AAAA, class IN, addr 2001:4860:4802:32::a
            Name: ns1.google.com
            Type: AAAA (IPv6 Address) (28)
            Class: IN (0x0001)
            Time to live: 156694 (1 day, 19 hours, 31 minutes, 34 seconds)
            Data length: 16
            AAAA Address: 2001:4860:4802:32::a
        ns2.google.com: type AAAA, class IN, addr 2001:4860:4802:34::a
            Name: ns2.google.com
            Type: AAAA (IPv6 Address) (28)
            Class: IN (0x0001)
            Time to live: 156694 (1 day, 19 hours, 31 minutes, 34 seconds)
            Data length: 16
            AAAA Address: 2001:4860:4802:34::a
        ns3.google.com: type AAAA, class IN, addr 2001:4860:4802:36::a
            Name: ns3.google.com
            Type: AAAA (IPv6 Address) (28)
            Class: IN (0x0001)
            Time to live: 156694 (1 day, 19 hours, 31 minutes, 34 seconds)
            Data length: 16
            AAAA Address: 2001:4860:4802:36::a
        ns4.google.com: type AAAA, class IN, addr 2001:4860:4802:38::a
            Name: ns4.google.com
            Type: AAAA (IPv6 Address) (28)
            Class: IN (0x0001)
            Time to live: 156694 (1 day, 19 hours, 31 minutes, 34 seconds)
            Data length: 16
            AAAA Address: 2001:4860:4802:38::a
    [Request In: 39]
    [Time: 0.002068000 seconds]

No.     Time           Source                Destination           Protocol Length Info
     41 2.444528       192.168.1.127         216.58.215.68         TCP      78     62523 → 443 [SYN] Seq=0 Win=65535 Len=0 MSS=1460 WS=64 TSval=777737389 TSecr=0 SACK_PERM=1

Frame 41: 78 bytes on wire (624 bits), 78 bytes captured (624 bits) on interface en0, id 0
Ethernet II, Src: Apple_2b:95:95 (f8:ff:c2:2b:95:95), Dst: Cisco-Li_4e:60:1e (c8:d7:19:4e:60:1e)
Internet Protocol Version 4, Src: 192.168.1.127, Dst: 216.58.215.68
Transmission Control Protocol, Src Port: 62523, Dst Port: 443, Seq: 0, Len: 0

No.     Time           Source                Destination           Protocol Length Info
     42 2.458329       172.217.16.14         192.168.1.127         TCP      66     443 → 62243 [ACK] Seq=744 Ack=744 Win=1050 Len=0 TSval=854526929 TSecr=777737382

Frame 42: 66 bytes on wire (528 bits), 66 bytes captured (528 bits) on interface en0, id 0
Ethernet II, Src: Cisco-Li_4e:60:1e (c8:d7:19:4e:60:1e), Dst: Apple_2b:95:95 (f8:ff:c2:2b:95:95)
Internet Protocol Version 4, Src: 172.217.16.14, Dst: 192.168.1.127
Transmission Control Protocol, Src Port: 443, Dst Port: 62243, Seq: 744, Ack: 744, Len: 0

No.     Time           Source                Destination           Protocol Length Info
     43 2.460663       216.58.215.68         192.168.1.127         TCP      74     443 → 62523 [SYN, ACK] Seq=0 Ack=1 Win=60192 Len=0 MSS=1380 SACK_PERM=1 TSval=2443474933 TSecr=777737389 WS=256

Frame 43: 74 bytes on wire (592 bits), 74 bytes captured (592 bits) on interface en0, id 0
Ethernet II, Src: Cisco-Li_4e:60:1e (c8:d7:19:4e:60:1e), Dst: Apple_2b:95:95 (f8:ff:c2:2b:95:95)
Internet Protocol Version 4, Src: 216.58.215.68, Dst: 192.168.1.127
Transmission Control Protocol, Src Port: 443, Dst Port: 62523, Seq: 0, Ack: 1, Len: 0

No.     Time           Source                Destination           Protocol Length Info
     44 2.460707       192.168.1.127         216.58.215.68         TCP      66     62523 → 443 [ACK] Seq=1 Ack=1 Win=131328 Len=0 TSval=777737404 TSecr=2443474933

Frame 44: 66 bytes on wire (528 bits), 66 bytes captured (528 bits) on interface en0, id 0
Ethernet II, Src: Apple_2b:95:95 (f8:ff:c2:2b:95:95), Dst: Cisco-Li_4e:60:1e (c8:d7:19:4e:60:1e)
Internet Protocol Version 4, Src: 192.168.1.127, Dst: 216.58.215.68
Transmission Control Protocol, Src Port: 62523, Dst Port: 443, Seq: 1, Ack: 1, Len: 0

No.     Time           Source                Destination           Protocol Length Info
     45 2.460836       192.168.1.127         216.58.215.68         TLSv1.3  646    Client Hello

Frame 45: 646 bytes on wire (5168 bits), 646 bytes captured (5168 bits) on interface en0, id 0
Ethernet II, Src: Apple_2b:95:95 (f8:ff:c2:2b:95:95), Dst: Cisco-Li_4e:60:1e (c8:d7:19:4e:60:1e)
Internet Protocol Version 4, Src: 192.168.1.127, Dst: 216.58.215.68
Transmission Control Protocol, Src Port: 62523, Dst Port: 443, Seq: 1, Ack: 1, Len: 580
Transport Layer Security

No.     Time           Source                Destination           Protocol Length Info
     46 2.476941       216.58.215.68         192.168.1.127         TCP      66     443 → 62523 [ACK] Seq=1 Ack=581 Win=61440 Len=0 TSval=2443474949 TSecr=777737404

Frame 46: 66 bytes on wire (528 bits), 66 bytes captured (528 bits) on interface en0, id 0
Ethernet II, Src: Cisco-Li_4e:60:1e (c8:d7:19:4e:60:1e), Dst: Apple_2b:95:95 (f8:ff:c2:2b:95:95)
Internet Protocol Version 4, Src: 216.58.215.68, Dst: 192.168.1.127
Transmission Control Protocol, Src Port: 443, Dst Port: 62523, Seq: 1, Ack: 581, Len: 0

No.     Time           Source                Destination           Protocol Length Info
     47 2.477224       216.58.215.68         192.168.1.127         TLSv1.3  278    Server Hello, Change Cipher Spec, Application Data

Frame 47: 278 bytes on wire (2224 bits), 278 bytes captured (2224 bits) on interface en0, id 0
Ethernet II, Src: Cisco-Li_4e:60:1e (c8:d7:19:4e:60:1e), Dst: Apple_2b:95:95 (f8:ff:c2:2b:95:95)
Internet Protocol Version 4, Src: 216.58.215.68, Dst: 192.168.1.127
Transmission Control Protocol, Src Port: 443, Dst Port: 62523, Seq: 1, Ack: 581, Len: 212
Transport Layer Security

No.     Time           Source                Destination           Protocol Length Info
     48 2.477259       192.168.1.127         216.58.215.68         TCP      66     62523 → 443 [ACK] Seq=581 Ack=213 Win=131072 Len=0 TSval=777737420 TSecr=2443474949

Frame 48: 66 bytes on wire (528 bits), 66 bytes captured (528 bits) on interface en0, id 0
Ethernet II, Src: Apple_2b:95:95 (f8:ff:c2:2b:95:95), Dst: Cisco-Li_4e:60:1e (c8:d7:19:4e:60:1e)
Internet Protocol Version 4, Src: 192.168.1.127, Dst: 216.58.215.68
Transmission Control Protocol, Src Port: 62523, Dst Port: 443, Seq: 581, Ack: 213, Len: 0

No.     Time           Source                Destination           Protocol Length Info
     49 2.481426       192.168.1.127         216.58.215.68         TLSv1.3  130    Change Cipher Spec, Application Data

Frame 49: 130 bytes on wire (1040 bits), 130 bytes captured (1040 bits) on interface en0, id 0
Ethernet II, Src: Apple_2b:95:95 (f8:ff:c2:2b:95:95), Dst: Cisco-Li_4e:60:1e (c8:d7:19:4e:60:1e)
Internet Protocol Version 4, Src: 192.168.1.127, Dst: 216.58.215.68
Transmission Control Protocol, Src Port: 62523, Dst Port: 443, Seq: 581, Ack: 213, Len: 64
Transport Layer Security

No.     Time           Source                Destination           Protocol Length Info
     50 2.481527       192.168.1.127         216.58.215.68         TLSv1.3  158    Application Data

Frame 50: 158 bytes on wire (1264 bits), 158 bytes captured (1264 bits) on interface en0, id 0
Ethernet II, Src: Apple_2b:95:95 (f8:ff:c2:2b:95:95), Dst: Cisco-Li_4e:60:1e (c8:d7:19:4e:60:1e)
Internet Protocol Version 4, Src: 192.168.1.127, Dst: 216.58.215.68
Transmission Control Protocol, Src Port: 62523, Dst Port: 443, Seq: 645, Ack: 213, Len: 92
Transport Layer Security

No.     Time           Source                Destination           Protocol Length Info
     51 2.481786       192.168.1.127         216.58.215.68         TLSv1.3  1391   Application Data

Frame 51: 1391 bytes on wire (11128 bits), 1391 bytes captured (11128 bits) on interface en0, id 0
Ethernet II, Src: Apple_2b:95:95 (f8:ff:c2:2b:95:95), Dst: Cisco-Li_4e:60:1e (c8:d7:19:4e:60:1e)
Internet Protocol Version 4, Src: 192.168.1.127, Dst: 216.58.215.68
Transmission Control Protocol, Src Port: 62523, Dst Port: 443, Seq: 737, Ack: 213, Len: 1325
Transport Layer Security

No.     Time           Source                Destination           Protocol Length Info
     52 2.496929       216.58.215.68         192.168.1.127         TCP      66     443 → 62523 [ACK] Seq=213 Ack=737 Win=61440 Len=0 TSval=2443474969 TSecr=777737424

Frame 52: 66 bytes on wire (528 bits), 66 bytes captured (528 bits) on interface en0, id 0
Ethernet II, Src: Cisco-Li_4e:60:1e (c8:d7:19:4e:60:1e), Dst: Apple_2b:95:95 (f8:ff:c2:2b:95:95)
Internet Protocol Version 4, Src: 216.58.215.68, Dst: 192.168.1.127
Transmission Control Protocol, Src Port: 443, Dst Port: 62523, Seq: 213, Ack: 737, Len: 0

No.     Time           Source                Destination           Protocol Length Info
     53 2.497287       216.58.215.68         192.168.1.127         TLSv1.3  646    Application Data, Application Data

Frame 53: 646 bytes on wire (5168 bits), 646 bytes captured (5168 bits) on interface en0, id 0
Ethernet II, Src: Cisco-Li_4e:60:1e (c8:d7:19:4e:60:1e), Dst: Apple_2b:95:95 (f8:ff:c2:2b:95:95)
Internet Protocol Version 4, Src: 216.58.215.68, Dst: 192.168.1.127
Transmission Control Protocol, Src Port: 443, Dst Port: 62523, Seq: 213, Ack: 737, Len: 580
Transport Layer Security

No.     Time           Source                Destination           Protocol Length Info
     54 2.497288       216.58.215.68         192.168.1.127         TLSv1.3  97     Application Data

Frame 54: 97 bytes on wire (776 bits), 97 bytes captured (776 bits) on interface en0, id 0
Ethernet II, Src: Cisco-Li_4e:60:1e (c8:d7:19:4e:60:1e), Dst: Apple_2b:95:95 (f8:ff:c2:2b:95:95)
Internet Protocol Version 4, Src: 216.58.215.68, Dst: 192.168.1.127
Transmission Control Protocol, Src Port: 443, Dst Port: 62523, Seq: 793, Ack: 737, Len: 31
Transport Layer Security

No.     Time           Source                Destination           Protocol Length Info
     55 2.497333       192.168.1.127         216.58.215.68         TCP      66     62523 → 443 [ACK] Seq=2062 Ack=793 Win=130496 Len=0 TSval=777737439 TSecr=2443474970

Frame 55: 66 bytes on wire (528 bits), 66 bytes captured (528 bits) on interface en0, id 0
Ethernet II, Src: Apple_2b:95:95 (f8:ff:c2:2b:95:95), Dst: Cisco-Li_4e:60:1e (c8:d7:19:4e:60:1e)
Internet Protocol Version 4, Src: 192.168.1.127, Dst: 216.58.215.68
Transmission Control Protocol, Src Port: 62523, Dst Port: 443, Seq: 2062, Ack: 793, Len: 0

No.     Time           Source                Destination           Protocol Length Info
     56 2.497349       192.168.1.127         216.58.215.68         TCP      66     62523 → 443 [ACK] Seq=2062 Ack=824 Win=130496 Len=0 TSval=777737439 TSecr=2443474970

Frame 56: 66 bytes on wire (528 bits), 66 bytes captured (528 bits) on interface en0, id 0
Ethernet II, Src: Apple_2b:95:95 (f8:ff:c2:2b:95:95), Dst: Cisco-Li_4e:60:1e (c8:d7:19:4e:60:1e)
Internet Protocol Version 4, Src: 192.168.1.127, Dst: 216.58.215.68
Transmission Control Protocol, Src Port: 62523, Dst Port: 443, Seq: 2062, Ack: 824, Len: 0

No.     Time           Source                Destination           Protocol Length Info
     57 2.497468       192.168.1.127         216.58.215.68         TLSv1.3  97     Application Data

Frame 57: 97 bytes on wire (776 bits), 97 bytes captured (776 bits) on interface en0, id 0
Ethernet II, Src: Apple_2b:95:95 (f8:ff:c2:2b:95:95), Dst: Cisco-Li_4e:60:1e (c8:d7:19:4e:60:1e)
Internet Protocol Version 4, Src: 192.168.1.127, Dst: 216.58.215.68
Transmission Control Protocol, Src Port: 62523, Dst Port: 443, Seq: 2062, Ack: 824, Len: 31
Transport Layer Security

No.     Time           Source                Destination           Protocol Length Info
     58 2.503055       216.58.215.68         192.168.1.127         TCP      66     443 → 62523 [ACK] Seq=824 Ack=2062 Win=64256 Len=0 TSval=2443474975 TSecr=777737424

Frame 58: 66 bytes on wire (528 bits), 66 bytes captured (528 bits) on interface en0, id 0
Ethernet II, Src: Cisco-Li_4e:60:1e (c8:d7:19:4e:60:1e), Dst: Apple_2b:95:95 (f8:ff:c2:2b:95:95)
Internet Protocol Version 4, Src: 216.58.215.68, Dst: 192.168.1.127
Transmission Control Protocol, Src Port: 443, Dst Port: 62523, Seq: 824, Ack: 2062, Len: 0

No.     Time           Source                Destination           Protocol Length Info
